{
  "schema": "NRCU_FX_LOOK_V0_4",
  "look_id": "VS_MARK_LAYERED_EXAMPLE",
  "name": "VS Mark \u2014 Clean Source + Halo + RGB Tear",
  "revision": 1,
  "status": "DRAFT",
  "metadata": {
    "migrated_from": null
  },
  "layers": [
    {
      "layer_id": "layer-halo-0001",
      "name": "Large Outer Halo",
      "type": "FX",
      "enabled": true,
      "locked": false,
      "opacity": 0.72,
      "blend_mode": "SCREEN",
      "plane": "TARGET_UNDERLAY",
      "input": "ORIGINAL_SOURCE",
      "transform": {
        "position_px": [
          0,
          0
        ],
        "scale": [
          1,
          1
        ],
        "rotation_deg": 0,
        "pivot": [
          0.5,
          0.5
        ],
        "flip_x": false,
        "flip_y": false
      },
      "displacement": {
        "enabled": false,
        "driver": "NOISE",
        "amount_px": [
          0,
          0
        ],
        "scale": 1,
        "speed": 0,
        "phase": 0,
        "seed": 1001,
        "angle_deg": 0,
        "edge_mode": "TRANSPARENT",
        "custom_texture": null,
        "influence_mask": null,
        "time_source": "PRESENTATION_TIME"
      },
      "mask": {
        "enabled": true,
        "source": "ORIGINAL_SOURCE_ALPHA",
        "region": "OUTER_BAND",
        "space": "LAYER_SPACE",
        "expand_contract_px": 14,
        "width_px": 44,
        "feather_px": 18,
        "invert": false,
        "custom_mask": null
      },
      "fx": {
        "template": "OUTER_HALO",
        "fx_size": 1.6,
        "fx_intensity": 1.2
      },
      "motion": {}
    },
    {
      "layer_id": "layer-source-0001",
      "name": "Source",
      "type": "SOURCE",
      "enabled": true,
      "locked": false,
      "opacity": 1,
      "blend_mode": "NORMAL",
      "plane": "TARGET_SOURCE",
      "transform": {
        "position_px": [
          0,
          0
        ],
        "scale": [
          1,
          1
        ],
        "rotation_deg": 0,
        "pivot": [
          0.5,
          0.5
        ],
        "flip_x": false,
        "flip_y": false
      },
      "displacement": {
        "enabled": false,
        "driver": "NOISE",
        "amount_px": [
          0,
          0
        ],
        "scale": 1,
        "speed": 0,
        "phase": 0,
        "seed": 42,
        "angle_deg": 0,
        "edge_mode": "TRANSPARENT",
        "custom_texture": null,
        "influence_mask": null,
        "time_source": "PRESENTATION_TIME"
      },
      "mask": {
        "enabled": false,
        "source": "NONE",
        "region": "FULL",
        "space": "LAYER_SPACE",
        "expand_contract_px": 0,
        "width_px": 0,
        "feather_px": 0,
        "invert": false,
        "custom_mask": null
      },
      "fx": {},
      "motion": {}
    },
    {
      "layer_id": "layer-rgb-0001",
      "name": "RGB Tear",
      "type": "FX",
      "enabled": true,
      "locked": false,
      "opacity": 0.65,
      "blend_mode": "ADD",
      "plane": "TARGET_OVERLAY",
      "input": "ORIGINAL_SOURCE",
      "transform": {
        "position_px": [
          0,
          0
        ],
        "scale": [
          1,
          1
        ],
        "rotation_deg": 0,
        "pivot": [
          0.5,
          0.5
        ],
        "flip_x": false,
        "flip_y": false
      },
      "displacement": {
        "enabled": false,
        "driver": "NOISE",
        "amount_px": [
          0,
          0
        ],
        "scale": 1,
        "speed": 0,
        "phase": 0,
        "seed": 7,
        "angle_deg": 0,
        "edge_mode": "TRANSPARENT",
        "custom_texture": null,
        "influence_mask": null,
        "time_source": "PRESENTATION_TIME"
      },
      "mask": {
        "enabled": true,
        "source": "ORIGINAL_SOURCE_ALPHA",
        "region": "EDGE_BAND",
        "space": "LAYER_SPACE",
        "expand_contract_px": 0,
        "width_px": 20,
        "feather_px": 8,
        "invert": false,
        "custom_mask": null
      },
      "fx": {
        "template": "RGB_TEAR",
        "rgb_shift_px": 18
      },
      "motion": {}
    }
  ]
}
